{
  "platform_id": "mastodon",
  "display_name": "Mastodon",
  "char_limit": 500,
  "link_char_cost": 23,
  "hashtag_limit": null,
  "hashtag_warn_above": 5,
  "links_clickable": true,
  "aliases": ["mastodon"],
  "media": {
    "max_images": 4,
    "max_videos": 1,
    "images_and_video_exclusive": true,
    "allowed_image_formats": ["jpeg", "jpg", "png", "gif", "webp"],
    "allowed_video_formats": ["mp4", "mov", "webm"],
    "max_image_size_bytes": 10485760,
    "max_video_size_bytes": 41943040,
    "min_image_width_px": null,
    "min_image_height_px": null,
    "max_image_width_px": null,
    "max_image_height_px": null
  },
  "_notes": "char_limit=500 is the Mastodon server default; individual instances may raise this limit. link_char_cost=23 follows the same convention as Twitter (URLs counted at 23 chars on most instances). max_image_size_bytes=10 MB. max_video_size_bytes=40 MB. Instance-specific limits are not supported by this config layer (PLACEHOLDER — if multi-instance support is needed, extend with an instance_url field)."
}
